category,text
nat-gas,"STATOIL SEEKS SHARE IN THAI GAS FIELD  Norway's state oil company  Den Norske Stats Oljeselskap A/S (Statoil) &lt;STAT.OL>, has told  Thai authorities it is interested in taking a 30 pct share in a  big offshore Thailand gas field, Statoil said.      The field, in the southern sector of the Gulf of Thailand,  is currently operated by U.S. Oil company Texas Pacific Oil Co  Inc, a unit of Canada's Seagram Co Ltd &lt;VO.N>. Thailand's state  oil company &lt;Petroleum Authority Thailand> (PTT) also holds a  major stake in the field.      PTT wants to develop the field and has asked Statoil to  consider co-development if the field's licence is renewed.      PTT, according to Statoil, is currently negotiating with  Texas Pacific to buy back the Dallas-based oil company's  holdings in the field.      ""PTT must first sort out its problems with Texas Pacific.  When this is done, we have said we are interested in taking  over a 30 pct share in the field,"" Statoil spokesman Willy Olsen  told Reuters.      Statoil, hired by PTT to carry out an independent appraisal  of the field's reserves and propose a development plan, has  estimated the field could be commercially developed at a cost  of some 700 mln crowns.      Industry sources said Texas Pacific has submitted lower  reserve estimates for the field than Statoil and shown little  interest in its development. Statoil refused to disclose its  upgraded reserve estimate for the field.      The field's reserves could be sold domestically through  Thailand's gas distribution network or by converting the gas to  electricity, the sources said.      Sources would not say which field Statoil is considering.  "
gold,"MORE GOLD DETECTED AT DOYON MINE  Lac Minerals Ltd and Cambior Inc said  they completed a second hole at their jointly owned Doyon mine  in Quebec, which showed two significant gold intersections.      One intersection graded 0.33 ounce gold per short ton over  44 feet at depth of 1,411 feet, while the other graded 0.22  ounce gold per ton over 23 feet at 2,064 feet, the companies  said. The hole is 460 feet east of the previously reported  first hole.      Another hole is being drilled 460 feet to the west of the  first drill hole and results are expected in late March or  early April.  "
gold,"PIONEER GROUP UNIT GETS MORE GHANA GOLD LAND  The Pioneer Group Inc said its 70  pct-owned Teberebie Goldfields Ltd venture was granted an  additional concession of land in Ghana to seek and mine gold.      The State Gold Mining Corp of Ghana granted the venture an  additional 14.5 square kilometers in Teberebie, Ghana,  contiguous to 11.5 square kilometers granted earlier.      The original concession appears to have a substantial  amount of gold bearing material containing about 2 grams, or  6/100 ounces, of gold per tonne. But the venture has no firm  estimate on the costs of extracting the gold and no assurances  can be given that the reserves can be mined profitably, the  company said. It said Teberebie Goldfields has not conducted  tests on the newly granted land but added the land seems to be  similar in geological characteristics to the original land.  "
gold,"GOLD PRODUCTION TO START AT KETZA RIVER  Canamax Resources Inc and Pacific  Trans-Ocean Resources Ltd said they conditionally approved  starting production at their jointly owned Ketza River gold  deposit in the Yukon after a study recommended the move.      They said production was conditional on approval of a water  license and arrangement of appropriate financing. They  estimated development costs for the mine and mill would total  21.1 mln dlrs, including three mln dlrs of working capital.      The feasibility study anticipated gold production of 49,600  ounces a year at a cost of 129 Canadian dlrs a short ton, they  said.      Canamax and Pacific Trans-Ocean said the project would  yield a 40 pct after-tax real rate of return at a gold price of  400 U.S. dlrs an ounce.      They said they would mine 460,000 tonnes of proven and  probable mineable reserves of oxide ore grading 0.45 ounce gold  per ton at a yearly rate of 112,000 tonnes for a mine life of  4.25 years.      Possible reserves of 75,000 tonnes grading 0.38 ounce gold  per ton at the break zone would extend mine life by a year,  with considerable potential for development of further oxide  ore reserves at the deposit, they said.  "
gnp,"U.S. GNP PRICE DEFLATOR ROSE 0.7 PCT IN 4TH QTR, UNCHANGED  U.S. GNP PRICE DEFLATOR ROSE 0.7 PCT IN 4TH QTR, UNCHANGED  "
nat-gas,"ARKLA &lt;ALG> PROPOSAL TO SETTLE DISPUTE  Arkla Inc said it and  International Paper Co &lt;IP> filed a proposal with the Arkansas  Public Service Commission designed to resolve the dispute  between the two over IP's plan to build natural gas pipelines  for its paper mill facilities at Pine Bluff and Camden.      Arkla's pipeline division, Arkla Energy Resources,  currently delivers all of the natural gas consumed at the two  mills.      Under the proposal, Arkla will support IP's plan to build  the alternate pipelines, while IP will allow Arkla's pipeline  division to deliver an equal quantity of competitively priced  supplies to other IP facilities.  "
gold,"ECHO BAY &lt;ECO> HAS NEVADA GOLD DISCOVERY  Echo Bay Mines Ltd said it  discovered a gold deposit in the Cove area near its McCoy gold  mine in Nevada.      Echo Bay said it encountered gold in 39 of 42 drill holes  at Cove. It said seven holes averaged 0.185 ounce gold a short  ton and 1.8 ounces of silver, with the seven intersections  averaging 118 feet in thickness beneath 25 feet of overburden.      The discovery is on the McCoy property, one mile northeast  of the McCoy open pit, heap leach gold mine, which is expected  to produce about 85,000 ounces of gold this year, Echo Bay  said.  "
nat-gas,"BP &lt;BP> RAISES NORTH SEA BUTANE PRICES  British Petroleum Co plc said it raised  its posted butane prices by 15.50 dlrs per tonne to 123 dlrs,  fob north sea, effective today.      Posted propane prices were unchanged at 110 dlrs per tonne,  the company said.  "
livestock,"LMFE TO CONCENTRATE ON CASH SETTLED CONTRACTS  The London Meat Futures Exchange, LMFE,  will cease trading in its deliverable pigmeat contract from  April 3, the LMFE said.      The move will enable the exchange to concentrate on the  cash settled contracts introduced last year.      ""This allows the exchange and its members to concentrate our  marketing on the pig and live cattle contracts,"" LMFE official  Peter Freeman said. ""These two have already shown their  effectiveness for hedging, and the trade in both contracts is  increasing,"" he added.      ""Using the futures market allows better planning and forward  price fixing that our industry needs,"" chairman Pat Elmer said.      Some 131 pig contracts were settled against the Meat and  Livestock Commission's Average All Pigs Price in February,  which represents hedging for over 13,000 pigs, more than twice  the number cash-settled in January, the LMFE said.      Cash settlement on the new cattle and pig contracts was  introduced last June in the expectation that the appeal of the  futures market to farmers, abattoirs and users of meat would  increase because of the absence of a delivery requirement.  "
gold,"HOMESTAKE &lt;HM> MULLS BUYING ORE RESERVES  Homestake Mining Co is considering  acquiring more gold ore reserves in addition to the company's  exploration efforts, chief executive Harry Conger told Reuters  in an interview.      ""We are looking at more options to acquire more reserves  rather than just exploration,"" Conger said adding, ""the move to  consider acquisitions represents a change in the company's  acquisitions policy.""      Conger said all of Homestake's current cash position of 120  mln dlrs would be available to acquire reserves. In addition,  Homestake has two lines of credit totaling 150 mln dlrs which  have not been drawn on today and could be used to finance an  acquisition, he said.      Conger said he anticipates 1987 exploration budget will be  about the same as 1986 spending of 27.3 mln dlrs. Conger said  exploration for precious metals may be slightly higher than  last year's spending of 17.7 mln dlrs while oil and gas  exploration spending will be slightly less than last year's 9.6  pct.      Conger said he sees Homestake's 1987 gold production about  the same as 1986 gold production of 669,594 ounces.      However, 1987 first quarter production from its McLaughlin  reserve will be about 10 pct lower than last year's 45,400  ounces due to start-up production problems.      He said he believes gold prices will hold above the 400  U.S. dlr an ounce level for the rest of 1987.       IN 1986, company earnings were based an average market  price for gold of 368 dlrs an ounce.      Conger said a three pct change in gold prices represents a  12 cts a share impact on earnings but he declined to give a  specific forecast for 1987's first quarter, due to be released  in 10 days, or for full year 1987 results.  "
nat-gas,"NUI &lt;NUI> MAY SPIN OFF NONUTILITY OPERATIONS  NUI Corp said it is studying  the feasibility of spinning off nonutility subsidiaries to  shareholders.      The company said its propane disution, natural gas spot  marketing, data processing, oil and natural gas exploration and  production, natural gas gathering and underground pipe  replacement businesses had sales for the year ended September  30 of about 74 mln dlrs, or about 25 pct of total company  sales.  NUI's major subsidiary is utility Elizabethtown Gas.  "
gnp,"S. AFRICAN RESERVE BANK SAYS GROWTH RATE ON TARGET  South Africa recorded annualised  real growth in GDP of 3.25 pct in the first quarter of this  year and the economy should achieve the government's target of  three pct growth for 1987, the Reserve Bank said.      The South African central bank said in its quarterly  bulletin that confidence in the economy improved from January  to May 31 because of the higher gold price, a rise in the  nation's gold and foreign currency reserves and an improvement  in the rand's exchange rate to just under 50 U.S. Cents.      It noted the growth rate had slowed from 4.5 pct in the  third and fourth quarters of last year.      It also cited a three year debt recheduling agreement  reached with international creditors in March as evidence of  improved foreign perceptions of the South African economy.      The accord effectively extends a moratorium on most  repayments of 13 billion dlrs of South Africa's short term  foreign debt. Total foreign debt is 23 billion dlrs.      South Africa recorded a seasonally adjusted annualised  surplus on the current account of the balance of payments of  7.43 billion rand in the first quarter, compared with a surplus  of 7.24 billion rand in 1986. The bank said it was the ninth  consecutive current account surplus since the start of 1985.  "
livestock,"HOG REPORT SHOWS MORE HOGS ON FARMS  The USDA quarterly hogs and pig report  yesterday showed more hogs on U.S. farms compared to last year  as profitability resulting from low grain prices encouraged  producers to step up production, analysts said.      Most analysts seemed to agree with Chicago Mercantile  Exchange floor traders that the report will be viewed as  bearish to pork futures and futures prices may open sharply  lower today. Some traders and analysts expect limit declines in  nearby contracts, with spillover selling likely in cattle.      University of Missouri agronomist Glen Grimes said,""The  report shows that hog producers have responded to a very  desirable feeding ratio that they enjoyed for the past 10  months.""      Shearson Lehman analyst Chuck Levitt said hog futures  prices are above producers' break even points. Even if futures  fell the daily limit of 1.50 cents today, producers could still  lock in a profit, which increases the likelihood of heavy  selling pressure today.      ""We have not had a period of profitability of this  magnitude since last summer,"" Levitt said. ""In fact, hog  operations on many mixed livestock/grain enterprises have been  so profitable that it actually enabled some farmers to get back  on their feet and refinance their loans just based on the hog  operation alone.""      Levitt said the weight breakdown in the report also was  negative, in that some lead time was anticipated before the  slaughter increased from the previous year.      We expected farmers to increase hog operations, but we  didn't expect this degree of expansion to show up in a 10-state  spring report, Levitt added.      High hog corn ratios (the number of bushels of corn that  could be bought for 100 lbs of hog) and the resulting increased  profits, encouraged farmers and confinement operations to  increase production starting late last year.      Analysts also noted that part of the increase in the hog  herd resulted from a revision of the December report and  without the revision, the March report might have been very  close to average expectations.      Robin Fuller of Agri Analysis said the USDA made a major  upward revision of 105,000 head in the size of the breeding  herd in the December 1 report. So the December report was more  bearish than initially indicated.      But Fuller, as well as other analysts, expected the report  to be less negative on deferred futures contracts. Distant  contracts are already at a sharp discount to cash because  traders anticipated high farrowing intentions, she noted.      Discounts in the October and December contracts take into  consideration a six to seven pct increase in March/May  farrowing intentions, which was borne out in the March 1  report, Fuller said.      Grimes said, ""As far as the distant months are concerned,  if our first quarter pig crop is up only six pct and under 60  lb inventories actually up only five pct, it would take a  tremendous discount in price for each percent increase for us  to push down to the prices that the current futures show for  the July and August period.""      Jerry Abbenhaus, analyst for AGE Clearing noted that  distant futures prices are already 15 to 20 dlrs lower than  they were last summer.      ""If cash hogs at the 7-markets last year averaged 61 dlrs  during July, that doesn't mean hogs have to be 15 dlrs cheaper  this year because we have six pct more numbers,"" he said.  "
gold,"JAPAN CABINET APPROVES BILL ON GOLD COIN ISSUES  The cabinet has approved a bill making it  easier for the government to issue commemorative coins, a  Finance Ministry official said.      The bill, which must still be approved by parliament, would  take effect in April 1988. It would allow the government to  issue 1,000, 5,000 and 10,000 yen coins without special  legislation, although higher-valued coins would still need a  special law, the official said. At present it can only issue  coins of 500 yen or less.  "
gnp,"GERMAN 2.2 PCT GROWTH AVERAGE SEEN TO 1991  The economy will grow by an average  rate of 2.2 pct a year in real terms between now and the end of  1991, Westdeutsche Landesbank Girozentrale (WestLB) said in an  annual report.      A year ago WestLB had forecast average growth of just under  three pct for 1986-1990.      The 1987 report said gross national product would only  expand a real 1.7 pct this year -- below previous expectations  -- because of weaker exports. Growth rates will pick up later,  however, producing a 2.2 pct increase on average for the  five-year period.   MORE  "
gold,"GERMAN ANALYSTS SEE GOLD FIRMING LATER THIS YEAR  The price of gold bullion is likely  to rise in the second half of the year on increased private  investor demand, West German analysts said.      Gold could rise as high as 500 dlrs per ounce later this  year, said Peter Witte, director of Westdeutsche Landesbank  Girozentrale's trading division, after a presentation by the  U.S. Mint to promote its gold and silver Eagle series coins.      ""A lot will depend on oil prices and developments on stock  exchanges,"" Witte said, adding he saw gold positioned for  further rises once it breaks out above 450 dlrs.      Gold was fixed this morning in London at 411.30 dlrs.      Despite current strong interest in gold mine stocks, many  investors still want to buy physical gold, Witte said.      Interest in gold mine stocks may also wane if stock  exchange rallies under way in many countries start to waver.      Hermann Strohmeyer, vice president of Commerzbank AG's  foreign exchange trading and treasury department, said gold is  poised to rise to 460 to 470 dlrs an ounce in the second half  of this year.      The price is unlikely to fall much below 380 or 390 dlrs an  ounce, and probably will continue in a range between 380 and  430 dlrs in the first half of this year, he said.  "
livestock,"U.K. AGRICULTURAL FUTURES MARKETS TO MERGE  Three London markets which trade potato,  soymeal and meat futures said they will merge to form a new  Agricultural Futures Exchange.      Legal advisers have been instructed to implement the  amalgamation of the London Potato Futures Association, LPFA,  the London Meat Futures Exchange, LMFE, and the Grain and Feed  Trade Association's, GAFTA, Soya Bean Meal Futures Association,  SOMFA. No timetable was given.      Members of the three exchanges have been consulted,  Agricultural Futures Exchange secretary Bill Englebright told  Reuters, and no objections have been raised to the merger.      Three markets are involved at present but the new exchange  could ultimately combine five markets.      Discussions are taking place with the Baltic International  Freight Futures Exchange, BIFFEX, and the GAFTA London Grain  Futures Market is considering the possibility of joining the  other markets, market officials said.      The BIFFEX board is expected to reach a decision on the  merger at its meeting at the end of this month, after members  are consulted at a meeting on March 16.      The grain futures market also intends to consult its  members soon, GAFTA director general James Mackie said.      The aim of the amalgamation is to limit regulatory and  administrative costs and achieve the recognition required under  the 1986 Financial Services Act. This legislation requires a  futures market to become a Recognised Investment Exchange, RIE,  for trading to continue.      Representatives of all the futures markets on the Baltic  Exchange have been discussing the possibility of a single RIE  structure since the beginning of the year.      The new exchange now planned will apply to the Securities  and Investments Board for recognition as an RIE ""at the  appropriate time,"" the Agricultural Futures Exchange said.      ""This commitment by the markets will enable progress to be  made to develop a stronger and more effective exchange to the  benefit of all those involved in the industry,"" the chairman of  the formation committee, Pat Elmer, said.      The merged markets will remain at the Baltic Exchange.  "
livestock,"USDA TO PROPOSE FOREIGN MEAT INSPECTION RULE  The U.S. Agriculture Department is  preparing a proposal that would require all foreign meat  products to be inspected at their point of arrival in the  United States, a USDA official said.      Donald Houston, administrator of USDA's Food Safety and  Inspection Service, FSIS, told a House Agriculture subcommittee  USDA was developing a proposed change in regulations that would  put an end to the current practice of permitting foreign meat  products to be unloaded at one port and inspected at another  port.      Houston said the requirement would be phased in over  several years to ""avoid disruptions and economic hardship.""  "
nat-gas,"AMOCO &lt;AN> OIL RESERVES DOWN, GAS UP IN 1986  Amoco Corp's petroleum liquids reserves  total 2.42 billion barrels at the end of 1986, down from 2.77  billion a year earlier, but its natural gas reserves increased  to 15.37 trillion cubic feet from 15.14 trillion, the company's  annual report said.      It said the drop in crude oil and natural gas liquid  reserves reflected downward revisions of previous estimates  caused by the sharp drop in oil prices last year. This  accounted for 178 mln barrels of a worldwide downward revision  of 188 mln barrels, with 158 mln barrels of the total revision  occurring in the United States, the report said.      Amoco said there were upward revisions in the size of its  worldwide gas reserves totalling 404 billion cubic feet last  year, while it discovered 568 billion cubic feet and purchased  298 billion cubic feet of reserves.      Production of one trillion cubic feet offset much of these  gains, the report said.      All of the gas reserve purchases, as well as all of the 14  mln barrels of oil reserves bought in 1986, were in the United  States, Amoco said, noting it has spent 1.1 billion dlrs to  acquire U.S. producing properties over the past three years.      Commenting on 1987, Amoco said acquisitions ""will be an  integral part of our strategy, should reserves become available  at attractive prices.""      The company said it expects ""the marketing climate for  natural gas to improve in 1987, which should provide the  opportunity for Amoco to expand sales. As prices and demand  improve, we are poised to accelerate capital spending on our  inventory of attractive opportunities.""      Amoco previously announced a 1987 capital spending budget  of 3.2 billion dlrs. Such spending totaled 3.18 billion dlrs  last year, down from 5.31 billion in 1985.  "
nat-gas,"NE ELECTRIC SEES HIGHER CONSTRUCTION OUTLAYS  New England Electric System &lt;NES>  expects its cash construction spending to reach 205 mln dlrs  this year, up from 188 mln dlrs in 1986, the utility said in  material distributed at an analysts meeting.      It said spending is expected to advance to 215 mln dlrs in  1988 and 220 mln dlrs in 1989.      The utility said these totals exclude spending on New  England Hydro-Transmission being built to import electricity  from Quebec Hydro. New England Electric is the operator of this  venture as well as owning 51 pct of the project.      The venture expects to spend 65 mln dlr this year, 105 mln  dlrs next year and 125 mln dlrs in 1989 to build transmission  lines from northern Quebec into New England, the utility said.      New England Electric said internally generated funds will  cover all of its power plant construction costs this year and  65 pct of the 108 mln dlrs its retail distribution units plan  to spend in 1987.      The company said it also expects to spend 60 mln dlrs on  its oil and gas activities this year, adding internally  generated funds are expected to provide 85 pct of this total.      New England Electric said it plans to issue 30 mln dlrs  worth of pollution control bonds in 1987 and retire additional  higher cost preferred stock. Its Granite State Electric unit  plans to issue five mln dlrs of long term notes early this year  as well.      The company said it does not plan to offer common shares  this year or in the foreseeable future, but expects to raise  about 40 mln dlrs in equity through the sale of stock under its  dividend reinvestment plan and employee share plans.      President Samuel Huntington told the analysts the  construction spending projection is based on the expectation  that demand for electricity in the New England electric system  will grow about two pct a year for the next 15 years.      However, the utility cannot ignore the potential for  sharper growth, he said, pointing out that demand was up 5.2  pct in 1986 and 4.7 pct per year in the past four years.      He attributed this growth to declining electricity prices  and a strong New England economy.      Huntington said New England Elecetric has ""all but rejected  new coal fired plants"" to supply additional power.      He said the most attractive new power supplies are those  with short lead times which can be built in modules.      Later, vice president Glenn Schleede said the utility is  looking at gas-fired, combined cycle generating units to supply  most of its new power needs, but has not rejected coal-fired  fluidized bed units.      He explained that fluidized bed technology is available in  modular units, adding that Huntington was referring to the  traditional coal-fired plant which burns pulverized coal.  "
livestock,"U.S. COLD STORAGE STOCKS - MARCH 1 FROZEN PORK BELLIES - LBS - 34,471,000, VS A REVISED 34,900,000 ON FEB 1 AND 51,218,000 A YEAR AGO.  U.S. COLD STORAGE STOCKS - MARCH 1 FROZEN PORK BELLIES - LBS - 34,471,000, VS A REVISED 34,900,000 ON FEB 1 AND 51,218,000 A YEAR AGO.  "
nat-gas,"ENDEVCO &lt;EI> AGREES TO BUY MISSISSIPPI PIPELINE  Endevco Inc said it has agreed to acquire  a 17.5-mile, 16-inch pipeline in Marion and Pearl River  Counties, Mississippi, for undisclosed terms.      The company said the pipeline was recently constructed from  the Poplarville gas field in Pearl River County to a proposed  interconnect with a pipeline operated by Occidental Petroleum  Corp's &lt;OXY> United Gas Pipe Line Co subsidiary in Marion  County but has nmot been placed in service.      Endevco said it plans to extend its existing Mississippi  Fuel Co System in southern Mississippi 18 miles to the new  pipeline.  "
