category,text
gnp,"GERMAN GNP FIGURES PUBLICATION DELAYED  Figures for first quarter 1987 West  German GNP will be published on June 11 after they were  provisionally scheduled for June 4, an official at the Federal  Statistics Office said.      The official said there had been a delay in gathering  information for the data, which are expected to show that the  West German economy contracted in the period.      A spokesman for the Economics Ministry in Bonn said there  was no political motivation behind publishing the figures on  June 11, the day after the Venice economic summit ends.      ""There is no political motivation. It is a purely technical  matter,"" he added.      The West German government is expected to come under  pressure in Venice from both the U.S. And its European partners  to stimulate domestic demand as a way of reducing international  trade imbalances and contributing to world economic growth.      However, government officials have ruled out any further  tax reduction packages to supplement a major program of  stimulatory fiscal measures already underway.      Helmut Schlesinger, vice-president of the West German  central bank, the Bundesbank, said in Tokyo today that GNP, the  widest measure of a country's economic activity, fell in real  terms by a seasonally adjusted 1/2 to one pct in the first  quarter compared with the fourth 1986 period.       The government has confirmed that growth was negative in  the first 1987 quarter. But year-on-year growth is expected to  be about two pct.      Schlesinger today repeated the Bundesbank's reluctance to  cut its official interest rates further. Its key discount rate,  at three pct, is just above historical lows.      West German officials are likely to emphasise at the Venice  summit that domestic demand, which draws in goods from abroad,  is already outstripping export performance, which has suffered  from an 80 pct rise of the mark against the dollar in just over  two years.      The government has pointed out that depressed exports are  the main reason for the current weakness in the economy, but  says that later in the year stronger domestic demand will  compensate for this setback.      It expects GNP growth for the whole of 1987 of just under  two pct, after a 2.4 pct rise in 1986.  "
gold,"GUNNAR GOLD IN VENTURE AGREEMENT  Gunnar Gold Inc said it and Mill City  Gold Inc signed an option and joint venture agreement with  Tyranex Gold Inc on the Tyranite gold property in Ontario.      Gunnar said it and Mill City can earn a 50 pct interest in  Tyranex's option to buy the Tyranite gold mine by spending up  to five mln dlrs on exploration, development, and feasibility  studies by 1990.      It said the companies may form a joint venture partnership  to bring the mine to full commercial production.  "
gnp,"U.K. GROWTH RATE SEEN AT THREE PCT THIS YEAR  Chancellor of the Exchequer Nigel  Lawson, presenting his budget for fiscal 1987/88 to parliament,  said U.K. Economic growth was forecast at three pct in calendar  1987.      He said the Treasury expected a current account balance of  payments deficit in 1987 of 2.5 billion stg, after a 1.1  billion shortfall in 1986. Inflation is expected to be 4.0 pct  at the end of 1987, he said, adding it may exceed 4.5 pct by  the summer before falling back to 4.0 pct by the end of the  year.      The planned PSBR for 1987/88 was 4.0 billion stg unchanged  when compared with the likely outturn for fiscal 1986/87,  Lawson said.      Although no explicit target was set for the broad sterling  M3 money supply, Lawson said broad money will continue to be  taken into account in assessing monetary conditions as well as  the exchange rate.      The low outturn of the PSBR in 1986/87 was mainly due to  the buoyancy of non-oil tax revenues in general, and the  corporation tax paid by an increasingly profitable business  sector in particular.      On oil prices, Lawson said he was sticking to his earlier  assumption that North Sea crude prices will average 15 dlrs per  barrel in calendar 1987. The treasury would strive to keep the  PSBR at 1.0 pct of GDP in future, he said.  "
gold,"CITY RESOURCES TO SELL GOLD PROPERTY STAKE  City Resources Ltd said it has agreed  in principle to sell a 50 pct interest in a group of mineral  properties in the southwest Pacific to a buyer it did not name  for 30 mln Canadian dlrs.      The company said a preliminary estimate of the geological  resources of one of the properties to a depth of 200 meters  indicates a potential of 1.2 mln ounces of gold, and by the  middle of 1987 it expects to establish proven ore reserves  containing at least 500,000 ounces of gold. Mining could start  in 1988, subject to a satisfactory feasibility study.      The company said completion of the transaction is subject  to regulatory and shareholder approvals.      City Resources is controlled by City Resources Ltd of  Australia.  "
nat-gas,"MALAYSIA SEEKS 42 BILLION YEN PIPELINE LOAN  Malaysia has asked Japan for a 42  billion yen 25-year loan to finance the construction of gas  pipelines from eastern Trengganu to southern Johor, the  Overseas Economic Cooperation Fund (OECF) said.      OECF's chief representative, Takashi Matsuya, told  reporters the Japanese Government is appraising the loan.  Another OECF official told Reuters Japan is likely to approve  the loan because ""it is technically and economically viable.""      If approved, the loan would carry a coupon rate of four  pct, a grace period of seven years, Matsuya said. It would be  disbursed over three years, he added.      The pipeline contruction is the second phase of the  Peninsular Gas Utilisation Project by Petronas, Malaysia's  national oil company.      The first phase was the supply of gas to households in and  around the eastern oil town of Kertih.  "
gnp,"U.S. OFFICIALS DISAGREE ON REDUCING BUDGET DEFICIT  Senior U.S. Economic officials  disagree on the likelihood the government can meet its budget  deficit reduction targets.      Beryl Sprinkel, chairman of the Council of Economic  Advisers, reiterated the Reagan Administration's opposition to  a tax increase and its pledge to reduce the deficit by cutting  spending and fostering economic growth.      By contrast, Rudolph Penner, Director of the Congressional  Budget Office, said the budget process has broken down and the  deficit will remain close to 200 billion dlrs for fiscal 1987.      Sprinkel told a symposium sponsored by New York University  that spending could be cut by avoiding decisions based on the  desire to influence votes and by shifting the responsibility  for local projects to state governments.      He also suggested a line-item veto, which allows the  President to veto parts of bill without rejecting all of it, to  limit wasteful spending. Spending and taxing decisions should  be linked more closely.      Sprinkel said the Administration still looks for 2.7 pct  growth in U.S. Real gross national product (GNP) in 1987 and  3.5 pct in 1988.      Asked if the latest economic reports signal this rate of  economic growth is attainable, Sprinkel said, ""It looks pretty  good to me. We've had two very strong employment reports.""      He also said federal reserve policy is appropriate, adding,  ""It looks like they're on track.""      While further reductions are needed in the trade deficit,  Sprinkel said the lower dollar is having an impact.      The new 1987 tax laws will not hurt the economy and the tax  reform act of 1986 significantly lowers tax rates and will  greatly increase private production incentives, he said.      ""Our estimates at the Council of Economic Advisers suggest  national net output of goods and services will permanently  increase by approximately two pct because of the long-run  consequences of tax reform,"" Sprinkel said. ""In 1986, this would  have amounted to an increase of approximately 600 dlrs in the  income of the average American family.""      Sprinkel also argued the 1981 tax cuts were not responsible  for the large increase in the budget deficit.      In fiscal 1986 ending September, federal spending amounted  to 23.8 pct of GNP, while federal receipts absorbed 18.5 pct of  GNP, leaving a deficit of 5.3 pct, he said.      Sprinkel said that, compared with fiscal 1978, the 1986  federal expenditure share of GNP is 2.7 percentage points  higher and the revenue share of GNP is virtually the same.      ""Contrary to the conventional wisdom, therefore, the 1981  tax cut is not the root cause of the extraordinary budget  deficits of the past few years,"" Sprinkel said.      ""This tax cut merely rolled back the inflation-induced tax  increases that occurred between 1978 and 1981,"" he added.      However, the Congressional Budget Office's Rudolph Penner  argued that the tax cut in 1981 was misguided.      ""Since making the big mistake in 1981 of cutting taxes  enormously without any plan to decrease spending by the  Administration or Congress, indeed with increases in defence  spending, now all the options (for reducing the budget deficit)  are unpleasant,"" he said.      Penner said the tax cut resulted from the ideological  turmoil in the U.S. Caused by the ""biggest sustained inflation  in our nation's history,"" which helped foster widespread  distrust of government.      ""The American people turned on the government with tax  revolt at the state level and new demands on the government at  the national level,"" Penner said.      ""But their dislike of taxes exceeded their general dislike  of spending programs. Now the correction of that 1981 mistake  demands that the system change a lot.""      Penner sees little hope the Gramm-Rudman-Hollings budget  deficit reduction targets will be met and said the deficit will  remain at roughly 200 billion dlrs this year.      He said a budget process that sets targets arbitrarily is  not likely to succeed.      ""I feel pretty safe in saying that any process that tries to  dictate a numerical outcome from above is doomed to fail simply  because there's no ... Way to enforce it,"" Penner said.      Penner questioned the methods by which the 1987 budget  deficit was cut. He said 18 to 19 billion dlrs were eliminated  by one-time measures, such as a temporary increase in taxes  related to tax reform and sales of government assets.      ""Another four billion dlrs was cut by what I call creative  timing changes, like moving the military payday from the last  day of fiscal 1987 to the first day of fiscal 1988. That saved  more than two billion dlrs,"" Penner said.  "
livestock,"JAPAN 1986/87 COMPOUND FEED OUTPUT UP 2.3 PCT  Japanese compound feed output rose 2.3 pct  to 25.80 mln tonnes in 1986/87 ended March 31 from 25.23 mln a  year earlier, the Agriculture Ministry said.      The marginal rise reflected slight growth in demand for  poultry raising and a moderate increase in demand for beef  cattle raising, Ministry officials said.      Compound feed sales totalled 26.01 mln tonnes in 1986/87  against 25.40 mln a year ago, while end-March stocks were  217,554 tonnes against 224,101.      Corn use in feed output in 1986/87 rose to 11.71 mln tonnes  from 11.02 mln a year earlier due to low import prices.      The officials said corn imports rose because the world  surplus and the yen's strength against the dollar reduced  Chicago prices. The corn compounding ratio rose to 45.2 pct in  1986/87 from 43.4 pct a year earlier.      Sorghum use rose marginally to 4.80 mln tonnes in 1986/87  from 4.79 mln, but the compounding ratio fell to 18.5 pct from  18.9 pct because of greater corn use. Higher import prices due  to poor harvests last year in major producing nations such as  Argentina made feed makers reluctant to use sorghum.      Soybean meal use fell to 2.58 mln tonnes from 2.63 mln and  the compounding ratio declined to 10.0 pct from 10.3 pct.      The drop in soybean meal consumption resulted from  increased use of cheaper rapeseed meal, the officials said.      Rapeseed consumption in 1986/87 was 563,889 tonnes against  528,152 a year earlier. The compounding ratio rose to 2.2 pct  from 2.1 pct.  "
livestock,"U.S. REFUSES PARTS OF TWO AUSTRALIA BEEF CARGOES  U.S. Agriculture Department  inspectors have refused entry to parts of two lots of  Australian beef because of pesticide residues, a spokeswoman  for the department said.      She said USDA has notified Australia, which assured it that  stricter controls would be implemented.      The Australian government had already imposed residue  controls and it is believed the meat with the presticide  residues was already in the pipeline before the controls were  put in place, the spokeswoman said.      There have been five other cases of Australian meat which  had residue levels above U.S. allowable limits this year, she  said.  "
nat-gas,"U.S. GULF OF MEXICO RIG COUNT CLIMBS TO 38.9 PCT  Utilization of offshore mobile rigs in  the Gulf of Mexico climbed by 2.1 pct last week to 38.9 pct,  reflecting a total of 91 working rigs, Offshore Data Services  said.      One year ago, the Gulf of Mexico utilization rate was 32.5  pct. Offshore Data Services said some drilling contractors had  reported recent increases of about 1,000 dlrs a day on large  jackup rigs, which now command rates of 11,000 to 12,000 dlrs a  day.      In the European/Mediterranean area the rig utilization rate  rose 0.6 pct to 53.6 pct, against 67.3 pct one year ago.      Worldwide rig utilization rose by 1.2 pct to 57.7 pct,  reflecting a net increase of eight working rigs. Offshore Data  Services said a total of 419 rigs were in use worldwide and 307  were idled last week.  "
gold,"GIANT BAY &lt;GBYLF> IN IDAHO GOLD VENTURE  Giant Bay Resources  Ltd said it signed an agreement in principle with Hecla Mining  Co for an operating joint venture on Hecla's Stibnite, Idaho,  gold deposit.      Giant Bay said if its bioleaching technology is used for  ore processing, it will have the right to acquire a working  interest in the property. It said it may spend as much as three  mln U.S. dlrs, excluding capital costs to bring the mine into  production. It said drilling has indicated substantial sulphide  reserves with a gold grade of about 0.1 ounce a ton, and early  tests show the gold ore responds to bioleaching.  "
livestock,"Ia-So Minn direct hogs estimated rcpts 95,000 vs actual week ago 93,000 and actual year ago 93,000.  Ia-So Minn direct hogs estimated rcpts 95,000 vs actual week ago 93,000 and actual year ago 93,000.  "
gold,"HECLA &lt;HL> TO BUY MINE STAKE FROM BP &lt;BP> UNIT  Hecla Mining Co said it  has agreed to purchase a 28 pct interest in the Greens Creek  Joint Venture from British Petroleum Co PLC's Amselco Minerals  Inc unit.      The venture expects to bring into production a  gold-silver-lead-zinc ore body on Admiralty Island, Alaska,  containing about 3,500,000 short tons of ore assaying about  0.18 ounce of gold, 24.0 ounces of silver, 9.7 pct zinc and 3.9  pct zinc per short ton, Hecla said.  It said there is  significant potential for the discovery of additional ore.      Hecla said initial production from a trackless underground  mine is scheduled for late 1988 at a rate of about 1,000 tons  or ore per day.  ""At this rate, the Greens Creek mine will be  the largest domestic silver mine and is expected to be one of  the lowest cost producers.""      The company said it estimates its total investment in the  project, including its share of preproduction costs, at about  45 mln dlrs, to be funded through internally generated cash and  existing lines of credit.  It said Amselco will retain a  majority interest in the project.  Other interest holders are  CSX Corp &lt;CSX> and &lt;Exaias Resources Corp>.  "
livestock,"CCC ACCEPTS BID FOR DAIRY CATTLE TO KUWAIT  The Commodity Credit Corporation  (CCC) has accepted a bid for an export bonus to cover the sale  of 380 head of dairy cattle to Kuwait, the U.S. Agriculture  Department said.      The dairy cattle are for shipment on or before May 31,  1987, it said.      The bonus of 1,465.00 dlrs per head was made to American  Marketing Services, Inc, and will be paid in the form of  commodities from the CCC inventory, it said.      An additional 761 head of dairy cattle are still available  to Gulf countries (kuwait, Bahrain, Oman, Qatar and the United  Arab Emirates under the Export Enhancement Program initiative  announced October 30, 1986, it said.  "
livestock,"U.K. OFFICIALS STUDY SALMONELLA/CALF FEED LINK  U.K. Officials are studying the possible  link between the use of antibiotics in calf feeds and the  spread of drug-resistant strains of salmonella in humans, a  Ministry of Agriculture official said.      A study published in the New England Journal of Medicine  yesterday stated that the spread of an unusual strain of  salmonella that is resistant to the drug chloramphenicol had  been shown to be linked to farms that used the drug to promote  the growth of cattle.     The U.K. Ministry of Agriculture is working with the  Department of Health and the Public Health Laboratory to  investigate the whole subject of resistant strains of  salmonella.      ""The Ministry of Agriculture is concerned about the possible  effects on human and animal health,"" the official said. The  government is also studying a recommendation from the Farm  Animal Welfare Council (FAWC) to restrict the trade of calves  under 56 days old through markets. The FAWC says this would  help reduce the spread of salmonella.  "
gold,"NORTHGATE &lt;NGX> QUEBEC ORE RESERVES DECLINE  Northgate Exploration Ltd said year-end  1986 ore reserves at its two Chibougamau mines in Quebec fell  to 8,141,150 short tons grading 0.077 ounce gold a ton and 1.63  pct copper from year-earlier 8,462,000 tons grading 0.077 ounce  gold ton and 1.67 pct copper.      The company said it launched a 700,000 dlr exploration  program at the mines to increase production and ensure the  operations' continued long life.      Ore production totaled 650,653 tons last year, it said,  estimating year-end reserves contained about 627,000 ounces of  gold and 265 mln pounds of copper.  "
nat-gas,TENNECO TO BECOME OPEN ACCESS TRANSPORTER OF NATURAL GAS  TENNECO TO BECOME OPEN ACCESS TRANSPORTER OF NATURAL GAS  
gold,"TALKING POINT/GOLD  The price of gold bullion and share  prices of North American gold stocks are benefiting from  continued weakness in the U.S. dollar, analysts said.      ""There's been a tug of war between the (currency)  speculators and the central banks over the U.S. dollar and it  looks like the game has gone to the speculators,"" said John Ing  at Maison Placements Canada Inc.      The dollar remained close to post-World War II lows today  against the Japanese yen despite buying by several central  banks, including the Federal Reserve, dealers said.      A drop in the dollar means uncertainty and gold is the  traditional hedge against uncertainty, Ing noted.      Another analyst, Richard Cohen at Brown Baldwin Nisker Ltd,  noted that ""a lot of foreign investors are holding U.S. dollars.  If they see they are losing money, they move back into gold.""      A dollar decline also has inflationary implications, Ing  said, adding that Maison Placements sees inflation rising to a  four pct annual rate from the current level of about three pct.      Ing predicts gold will peak at 510 dlrs this year from its  current level of about 416 dlrs per ounce. Cohen sees an  average price of 425 dlrs, and another analyst, Michael  Pickens, at Yorkton Securities, puts the average at 450 dlrs,  with a possible spike above 500 dlrs.      However, gold stocks in the U.S. and Canada have risen far  faster in recent months than the price of the metal itself,  causing concern among analysts that a correction lies somewhere  in the future. But for now, all analysts say there is no sign  the buying pressure is slowing down. ""The stocks have run an  incredible way,"" Cohen said.      On U.S. markets today, ASA Ltd &lt;ASA> rose 4-1/8 to 61-1/2,  Campbell Red Lake Mines &lt;CRK> was up 1-3/8 and Newmont Gold  &lt;NGC> increased 1-1/2 to 31-1/4.      The Toronto Stock Exchange gold index today was up 268  points at 8067.90. Hemlo Gold gained 1-1/4 at 26-3/4, LAC  Minerals was up 1-5/8 at 41, Placer Development rose 1-1/4 at  43-3/8 and Lacana Mining gained 1 at 18.      Ing pointed out that the TSE gold index has gained 51 pct  since December 31, 1986, while the price of bullion has  increased six pct. ""Canadian golds have been the top performing  index this year,"" he noted.      In the U.S., there is ""too much money chasing too few  stocks,"" Pickens said. And many investing institutions such as  pension funds and insurance companies still have excess cash,  he added.      Cohen also noted that today's silver price break through  six dlrs an ounce indicates small investors are entering the  precious metals market and he expects the ratio between gold  and silver prices to narrow.  "
gold,"&lt;TECHNIGEN PLATINUM CORP> IN METALS FIND  Technigen Platinum corp said it  initial results of a 13-hole drilling program on its R.M. Nicel  platinum property in Rouyn-Noranda, Quebec, indicate  ""extensive"" near-surface zones ""highly"" enriched in gold,  platinum and palladium were found in rocks on the periphery of  a sulphide deposit.      It said values of up to 0.073 ounce of platinum, 0.206  ounce palladium, three pct copper and 4.5 pct nickel were found  over a drill section of 13 feet.                       More  "
gnp,"FALL IN CANADIAN BUDGET DEFICIT TO SLOW  Finance Minister Michael Wilson said tax  reform will not affect his determination to reign in  expenditures, but his forecasts show a slowing of the decline  in the budget deficit in the late 1980s.      ""Responsible tax reform must be fiscally responsible,""  Wilson said in a speech prepared for the House of Commons.      Wilson estimated the deficit will fall to 29.3 billion dlrs  in the year ending March 31, 1988, the same level as he  forecast in the February budget.      And in the year ended this past March, the deficit was  expected to have been one billion dlrs lower than the 32  billion dlr shortfall originally forecast, Wilson said.      Wilson said in the current 1988 fiscal year  higher-than-anticipated spending, particularly in farm income  support programs, will be offset by higher-than-anticipated  revenues.      But finance department documents show the pace of deficit  reduction was expected to slow temporarily in fiscal 1989 and  1990 as a result of lower oil and grain prices and the  transition to the reformed taxation system.      The deficit is expected to total 28.9 billion dlrs in  fiscal 1989 and 28.6 billion dlrs in 1989 and then fall to 26.1  billion dlrs in 1991.      Wilson was optimistic about the outlook for the Canadian  economy, forcasting gross domestic product would expand 2.8 pct  this year and 3.0 pct in 1988. In 1986 the economy grew by an  actual 3.1 pct.      Inflation, meanwhile, is expected to stabilize at around  the current four pct level over the next two years.  "
gnp,"CHILEAN GDP UP 5.7 PCT IN 1986, CENTRAL BANK SAYS  chile's gross domestic product rose 5.7  pct last year to 18.8 billion dollars, compared to a 2.4 pct  rise in the previous year, the central bank said.      It said initial projections were for a 4.6 pct increase in  gdp this year.      The sectors which registered the greatest growth in 1986  were fisheries with 10 pct, agriculture at 8.7 pct, transport  and communications with 8.1 pct and industry at 8.0 pct, the  bank added.  "
gnp,"CANADA DECEMBER GDP GAINS 1.2 PCT  Canada's gross domestic product, by  industry, rose a seasonally adjusted 1.2 pct in December, the  largest monthly gain since April, 1986, Statistics Canada said.      GDP, which fell 0.2 pct in November, was 2.1 pct above the  December, 1985 level, the federal agency said.      Output of goods producing industries rose 1.6 pct in the  month, with virtually all the growth occurring in manufacturing  and mining. Services producing industries expanded 1.0 pct.  "
gold,"S. AFRICA GOLD MINING INDUSTRY HAD RECORD YEAR  The gold mining industry had  another ""exceptional year"" in 1986 with tonnage milled, revenues  and profits reaching high levels, the Chamber of Mines said.      Nearly 108 mln tons of ore was milled, three pct higher  than the prior year, while revenues rose 17 pct to 16.5 billion  rand and profits increased 6.5 pct to 8.31 billion rand, the  Chamber reported.      The profit rise was achieved despite substantial cost  increases and a 26.1 pct rise in capital expenditures to 2.42  billion rand, it said.      The chamber said that a ""comparatively buoyant gold price  allowed mines to continue the practise of mining lower grade  ores which has characterised recent years.""      It said the industry now mines to an average grade of 5.63  grams per ton compared with 6.09 grams per ton in 1985.      Gold output for the year declined five pct to 638 tons  compared with the previous year's 671 tons.  "
