category,text
nat-gas,"CANADA OIL EXPORTS RISE 20 PCT IN 1986  Canadian oil exports rose 20 pct in 1986  over the previous year to 33.96 mln cubic meters, while oil  imports soared 25.2 pct to 20.58 mln cubic meters, Statistics  Canada said.      Production, meanwhile, was unchanged from the previous year  at 91.09 mln cubic feet.      Natural gas exports plunged 19.4 pct to 21.09 billion cubic  meters, while Canadian sales slipped 4.1 pct to 48.09 billion  cubic meters.      The federal agency said that in December oil production  fell 4.0 pct to 7.73 mln cubic meters, while exports rose 5.2  pct to 2.84 mln cubic meters and imports rose 12.3 pct to 2.1  mln cubic meters.      Natural gas exports fell 16.3 pct in the month 2.51 billion  cubic meters and Canadian sales eased 10.2 pct to 5.25 billion  cubic meters.  "
gnp,"FRANCE FACES PRESSUE TO CHANGE POLICIES  France's right wing government is facing  growing pressure to modify its economic policies after revising  down its 1987 growth targets and revising up its inflation  forecasts for this year.      Moving reluctantly into line with most private sector  forecasts the government yesterday raised its 1987 inflation  estimate a half percentage point to 2.5 per cent and cut its  economic growth estimate to between two and 2.8 per cent from a  2.8 per cent target written into the annual budget last  september.      Finance Minister Edouard Balladur said the revised figures  would not push the government off its chosen mix of price  deregulation, budget-cutting rigour and pay restraint.      But Trade Union leaders served immediate notice they would  push to protect the purchasing power of their members, raising  the spectre of a vicious spiral of wage and price rises.      And bank economists contacted by Reuters said they believed  Prime Minister Jacques Chirac could be forced by slow growth  and rising unemployment to reflate the economy later this year,  perhaps in the autumn, to boost his prospects in Presidential  elections due by April 1988.      ""The outlook is more worrying than it was a few weeks ago,""  said Societe Generale economist Alain Marais. ""We have the  impression it may be difficult to get even two per cent growth  this year.""      ""The big question is whether the government's policy of wage  moderation will be maintained,"" he added.      The government has set public sector wage rises at aboout  1.7 per cent this year, with a three per cent ceiling for rises  justified by increased productivity.      But the head of the socialist CFDT union federation, Edmond  Maire, meeting with Chirac today, renewed union demands already  rejected by the government for indexation clauses to be built  into future pay contracts to safeguard workers against higher  prices.      Calling the government's policies ""unbalanced and unjust,"" he  also demanded investment incentives to boost employment. He  announced after his meeting that Chirac had told him the  government would spend two billion francs on a series of  measures to boost employment and training      Andre Bergeron, a widely respected leader of the moderate  Force Ouvriere labour group, put similar demands to Chirac  earlier in the week while the Communist-led CGT, the largest of  France's unions, declared the defence of its members earnings  its top priority.      But with unemployment nearing 11 per cent last month, and  still rising, government supporters and some economic analysts  said they were confident Chirac could resist union pay demands.      ""Salary indexation was ended by the previous Socialist  government and I dont think this administration is going to  reverse that,"" commented Michel Develle, economist at  recently-privatised Banque Paribas.      Damaging transport and electricity strikes over Christmas  and the New Year, partly blamed by the government for higher  inflation, had undermined the unions power and popularity, he  said.      Develle said Paribas expected inflation to rise even more  than the governments revised forecast, perhaps to 2.6 or 2.7  per cent this year against last years 2.1 per cent.      ""But that would still be an exceptional achievement  considering that for the first time since the Second World War  all french prices have been freed,"" he commented.      Finance Ministry officials said that the governments  abolition of price and rent controls last year was responsible  for nearly a quarter of a 0.9 per cent surge in January living  costs.      But they claimed it was a once-off phenomenon that should  have no knock-on impact on the rest of the year.      Both Marais and Develle said they agreed with that, so long  as the government kept wages under control.      Prices could rise 1.5 per cent in the first three months of  1987 and two per cent in the first half year, fractionally more  than forecast this week by the National Statistics Institute,  INSEE,  Marais said. But the second half year should be better,  he added.      Ironically, one side effect of higher inflation could be to  help the government achieve its aim of cutting the state budget  deficit, several analysts said.      So long as public sector wages are held down, higher Value  Added Tax receipts resulting from rising prices should offset a  loss in revenues that otherwise would result from slower than  expected growth, they said.  "
livestock,"JAPAN BEEF PRICE SUPPORT CUT WILL NOT RAISE DEMAND  Japan's plan to cut beef intervention  prices for the fiscal year starting April 1 will not boost  demand because of strict supply controls and a complex  distribution system, Japanese and U.S. Industry sources said.      ""Government beef policy protects farmers rather than meeting  consumers' demands and the cutback ... Is too marginal,"" a  Housewives Association of Japan official said.      Despite mounting U.S. Pressure on Japan to open farm  markets, beef is strictly controlled by the government, which  maintains a price stabilisation zone to protect farmers.      Under the plan, expected to be announced this month, the  standard or bottom price of castrated wagyu -- known as marbled  beef -- will be set at 1,370 yen per kilo for 1987/88 against  1,400 now, and the ceiling at 1,780 yen against 1,820.      The standard price of other beef, mainly produced from  dairy steers, is set at 1,020 yen against 1,090 and the ceiling  at 1,325 against 1,420.      Ministry officials said the semi-government Livestock  Industry Promotion Corp (LIPC) conducts buffer stock operations  to help keep wholesale beef prices within the intervention  price zone.      The LIPC is allowed to import most beef, with the amount  set by the government under a quota system. When wholesale  prices go above the ceiling, the LIPC releases its beef stocks,  both domestic and imported, and buys locally produced beef when  prices are below.      But the LIPC has often been criticised for releasing beef  stocks when the prices are higher than the ceiling.      Phillip Seng, Asian Director of the U.S. Meat Export  Federation, told Reuters the two pct cut in prices is a step  toward closing the gap with European Community prices, about  half those in Japan.      But Seng said the cut will not benefit consumers or U.S.  Meat exporters because of Japan's rigid and complicated  distribution system and strict supply control by the LIPC.      The Housewives Association official said retail beef prices  are high mainly because of distribution problems and high  production costs, as well as poor operations by the LIPC.      American meat packers see Japan as a promising market. F.C.  Beatty, of U.S. Packer John Morrell and Co, told the Japan  Times beef cuts, which sell for 1.20 to 3.00 dlrs a pound in  the U.S., Are sold at 15 to 30 dlrs in Japan.      But Seng said the cut will not benefit consumers or U.S.  Meat exporters because of Japan's rigid and complicated  distribution system and strict supply control by the LIPC.      The Housewives Association official said retail beef prices  are high mainly because of distribution problems and high  production costs, as well as poor operations by the LIPC.      American meat packers see Japan as a promising market. F.C.  Beatty, of U.S. Packer John Morrell and Co, told the Japan  Times beef cuts, which sell for 1.20 to 3.00 dlrs a pound in  the U.S., Are sold at 15 to 30 dlrs in Japan.      But industry sources said it is unclear how much demand  will pick up if retail beef prices drop following any sharp  reduction in intervention prices.      U.S. Agriculture Secretary Richard Lyng said this week he  will ask Japan to remove all beef import restrictions when he  visits here next month.      In 1984, Japan decided to increase its beef import quota by  9,000 tonnes a year until March 31, 1988.      In 1987/88, the quota will rise to 177,000 tonnes from  168,000 in 1986/87, ministry officials said, adding Japan wants  to keep self-sufficiency in beef at around 70 pct.  "
livestock,"HOG AND CATTLE SLAUGHTER GUESSTIMATES  Chicago Mercantile Exchange floor  traders and commission house representatives are guesstimating  today's hog slaughter at about 295,000 to 305,000 head versus  307,000 week ago and 311,000 a year ago.      Cattle slaughter is guesstimated at about 124,000 to  128,000 head versus 127,000 week ago and 126,000 a year ago.  "
nat-gas,"TRINTOC, UNION CARBIDE TO BUILD METHANOL PLANT  Trinidad and Tobago is  finalizing arrangements with Union Carbide &lt;UK> of the United  States and Snamprogetti of Italy for the construction of a  1,500 tonnes per day methanol plant, Energy Minister Kelvin  Ramnath said.      Ramnath said the ministry is now holding talks with Union  Carbide on the price of natural gas to be used in the plant,  which will be constructed near the Trinidad and Tobago oil  company (Trintoc) refinery at Point Fortin on the west coast.      Snamprogetti built the first methanol refinery on trinidad  five years ago.      Trintoc is likely to put up land, refinery plant and  machinery as equity. If negotiations go smoothly, ramnath said,  construction could begin by next january.      The government of prime minister A.N.R. Robinson is hoping  to lue new investors to the twin-island state's petrochemical  industry, in order to make use of new findings of natural gas.  "
gnp,"GERMAN RESEARCH INSTITUTE LOWERS GROWTH FORECAST  The DIW economic research institute  said West German economic growth in 1987 is unlikely to reach  the 1.5 pct rate it had forecast earlier this year.      The institute, whose forecasts are more pessimistic than  those of the other four leading German institutes, said the  economy had passed its peak in the summer of 1986, and its  prospects had dimmed significantly since the autumn.      The DIW repeated earlier predictions that gross national  product (GNP) in the first quarter of 1987 would contract in  real, seasonally adjusted terms against the weak final quarter  of last year.  "
gnp,"ITALIAN ECONOMIC OUTLOOK LESS BRIGHT, OECD SAYS  Italy's economic outlook for 1987 and 1988  is likely to be less favourable than last year with slightly  lower growth, higher unemployment and an increased trade  deficit, the Organisation for Economic Cooperation and  Development (OECD) said.      But the OECD, in its half-yearly report, forecast a  slightly lower inflation rate over the next two years. Last  year Italy ranked as one of the OECD's fastest growing  economies with Gross Domestic Product (GDP) growth at 2.7 pct.      The OECD said Italy's GDP may grow by three pct in 1987,  but will then fall back to 2.5 pct in 1988.      The inflation rate will probably stabilise at around five  pct during the projection period as a result of a turnaround in  import prices, particularly oil, an acceleration in labour  costs and the effects of domestic demand pressure, the report  said.      This year, and to a lesser degree in 1988, domestic demand  should be stimulated by buoyant growth in household consumption  made possible by wage increases following pay negotiations.      Domestic demand pressure, coupled with the deterioration in  Italian competitiveness, is likely to stimulate imports and  adversely affect exports in 1987 and 1988. This could result in  a sharp negative contribution to the currrent account.  "
nat-gas,"BROOKLYN UNION&lt;BU> SEEN HURT BY PIPELINE CLOSURE  Brooklyn Union Gas Co, a New York gas  utility, will see its gas costs up sharply as a result of  Transco Energy Co's &lt;E> decision to close its pipelines to  transport spot gas sales, energy industry analysts said.      Brooklyn Union, the fourth largest gas utility in the  United States, purchased 36 pct of its supplies on the spot, or  non-contract, market in 1986, and the proportion of spot  supplies was estimated much higher in the five months of 1987,  analysts said.      Texas Eastern pipelines &lt;TET>, the other competing  pipeline, to deliver spot gas from producing areas in the South  closed its gate station for summer, and Brooklyn Union has  relied entirely on Transco for spot supplies.       In the month of May, Brooklyn Union paid about two dlrs  per mln British Thermal Unit for spot gas, while contract gas  costs four to five dlrs per mln BTU, industry sources said.      Transco announced yesterday it would no longer provide open  access to transport spot natural gas to its customers for fear  of accumulating more take-or-pay liabilities.      Take-or-pay contracts oblige pipelines to pay producers for  gas even if delivery is not taken by its customers.      Brooklyn Union will continue receiving a small amount of  supplies from minor fields under a grandfather clause, a  Brooklyn Union official said.      Foster Corwith, gas analyst with Dean Witter Reynolds, said  most of the rising cost to Booklyn Union will be passed through  to rate payers.      While net effect on the company will not be known for  several months because of the time lag in deferred earnings,  end-users, especially residential and commercial customers,  will end up paying more for gas, he said.      Because the closure takes place in summer months when gas  demand is at seasonal low, the impact on cash flow would be  small, Curt Launer, natural gas analyst with Donaldson Lufkin  Jenrette, said.      If the situation persists into winter heating season, high  cost gas could cut in the company's profits, he said.      Gas utilities along eastern seaboard relying on Transco for  spot gas, such as North Carolina Natural Gas Co &lt;NCNG>,  Piedmont Natural Gas Co &lt;PNY>, will face the same high cost  factor as Brooklyn Union, Steve Richards, a supply manager with  end users supply system, a Houston based natural gas brokering  firm, said.      ""But these companies are not unwitting victims of the  take-or-pay dispute between Transco and producers,"" he said.      Distributors have turned a deaf ear to Transco's request  for an inventory charge, which reserves the pipeline facility  for spot gas to be delivered to these companies, he said.      Without spot supplies, the high cost of system gas will  threaten to drive away large customers capable of shifting to  alternative fuels, he said.      In absence of any guidelines on inventory charges from the  Federal Energy Regulatory Commission, the matter is being  negotiated between pipelines and customers, Richards said.      Now that Transco has refused to transport cheap spot gas  for them, these distributors are likely to be more conciliatory  on the inventory charge, he said.      ""Cool heads will prevail,"" DLJ's Launer said, "" but it may  take a while.""  "
livestock,"IRAQ CCC CREDIT GUARANTEES SWITCHED - USDA  The Commodity Credit Corporation  (CCC) has transferred 21.0 mln dlrs in credit guarantees  previously earmarked for sales of U.S. corn and 5.0 mln dlrs  for sales of oilseeds to increase available coverage on sales  of U.S. poultry meat to Iraq, the U.S. Agriculture Department  said.      The department said the action was taken at the request of  Iraq's State Trade Organization for Grains and Foodstuffs.      The guarantee line for sales of corn has been reduced from  78.0 mln dlrs to 57.0 mln and the line for oilseeds from 5.0  mln dlrs to zero.      The guarantee line for sales of frozen poultry has been  increased from 30.0 mln dlrs to 56.0 mln dlrs, USDA said.  "
nat-gas,"U.S. SEISMIC CREW COUNT DROPS 6 PCT IN FEBRUARY  The number of seismic crews  searching for oil and gas in the United States dropped by nine  to a total of 151 crews, a decrease of six pct from January,  the Society of Exploration Geophysicists said.      The February total represented a 49 pct decrease from  February 1986.      Worldwide, the association's monthly survey showed that  seismic exploration for oil and gas increased to 395 in  February, up three from the month before. Africa added three  seismic crews, the Middle East increased by two and the Far  East added one while reductions were reported in Central and  South America, Europe and the United States.  "
nat-gas,"INDIA PLANS MORE BOMBAY OFFSHORE OIL WELLS  India's state-owned Oil and Natural Gas  Commission (ONGC) plans to drill more wells in the Bombay  offshore area, where a well spudded in February this year gave  both oil and gas, an ONGC spokesman said.      The exploratory well, spudded at a depth of 2,140 metres,  yielded 2,000 barrels of oil and 180,000 cubic metres of gas  per day, he said.      ""The well, one of the four structures drilled in the area 80  km north-west of Bombay, indicates good prospects of both oil  and gas. We've decided to drill at least three more wells in  there before starting production on a commercial scale.""      Production of Bombay High, part of the Bombay offshore  field, has stabilised at around 500,000 barrels per day for the  last two years.      ONGC produced 27.85 mln tonnes of crude in 1986/87 ending  March, up from 27.51 the previous year. Bombay High accounted  for 20.61 mln tonnes, marginally up from 20.10 the year before.  India's total oil output is around 30 mln tonnes.      ONGC has been exploring the Bombay offshore area, developed  since the late 1970s, for more oil as production from Bombay  High has reached a plateau.  "
gnp,"DUTCH GROWTH LIKELY TO SLOW, JOBLESS RISE IN 1987  Leaks of a major Dutch official  economic forecast due to be published on Monday indicate  reduced economic growth and a renewed rise in unemployment this  year, political and market sources say.      Concern over an anticipated fall in Dutch competitiveness  this year against a background of an average 2-1/2 pct wage  increase, zero inflation and a firm guilder has triggered some  calls for a change in monetary policy to help boost growth.      But whatever the government's response, the central bank  will stick to its policy of keeping the guilder firm, they say.      The official forecasting agency Centraal Planbureau (CPB)  publishes its 1987 outlook at the start of a week which will  also see a key parliamentary debate on government finances and  the economy.      Merchant bank Pierson, Heldring en Pierson - in an estimate  reflecting general sentiment - said last month that Dutch  economic growth was now seen around one pct.      Domestic consumer spending is not expected to offset the  decline in export growth caused by slowing growth in West  Germany, the main Dutch trading partner, and the lower dollar,  Pierson said in its February economic outlook.      The latest growth forecasts are well below a 1.5 to two pct  growth figure seen by the CPB early last month and forecasts of  2.5 pct economic growth in 1987 made last September.      The fall in unemployment is bottoming out and the  government has already admitted it will not meet its goal of  reducing unemployment by an annual 50,000 from 1986 to 1990.      Some analysts and industry leaders have questioned central  bank policy of pegging the guilder firmly to the mark and if  necessary keeping interest rates up to support the guilder.      Employers federation NCW chairman Fred Lempers criticised  the guilder's revaluation in line with the West German mark in  last January's European Monetary System (EMS) realignment and  expressed concern over its effect on competitiveness.      But the employers federation VNO noted the Dutch economy  had become more competitive since 1980 and the fall of the  dollar was affecting this gain more than the EMS realignment.      Some analysts also question the central bank's decision not  to copy the latest Bundesbank discount rate cut and instead  lower money market rates and abolish a credit quota surcharge.      Central bank president Wim Duisenberg has defended the move  saying the bank had adjusted the rates with the most impact on  the money market, noting ""the (4.5 pct) discount rate is at the  moment not the most important Dutch rate because it is already  far below the market rates.""      Central bank officials say the heavy dependence on trade of  the Dutch economy requires a stable exchange rate, and interest  rate policies serve that goal.      Analysts noted a large capital outflow from the Netherlands  recently as foreign investments in Dutch stock are being sold  to take profits.      Loosening the tie between the guilder and the mark would  reduce international confidence in the guilder and make it more  dificult to attract foreign capital, they said, noting Dutch  interest rates rose sharply when the guilder was not revalued  completely in line with the mark in a 1983 EMS realignment.      Many Dutch banks have reacted favourably to the decision  not to copy the last German discount rate cut, but Pierson  warned it could actually add to uncertainty over the guilder.      Some analysts noted friction between the Finance Ministry  and the central bank, with Finance Minister Onno Ruding having  said before the Bundesbank discount rate cut he favoured lower  Dutch rates but that the Germans should move first.      One analyst said Ruding wanted to bring interest rates down  to reduce the government debt burden.      A Finance Ministry spokesman said lower interest rates were  needed but denied any suggestion of conflicting views between  the ministry and the central bank. ""The cabinet's policy is  steady, the guilder has to stay with the mark,"" he said.  "
gold,"PRECIOUS METALS CLIMATE IMPROVING, SAYS MONTAGU  The climate for precious metals is  improving with prices benefiting from renewed inflation fears  and the switching of funds from dollar and stock markets,  brokers Samuel Montagu and Co Ltd said.      Silver prices in March gained some 15 pct in dlr terms due  to a weak dollar and silver is felt to be fairly cheap relative  to gold, Montagu said in its monthly silver newsletter. In  March the gold/silver ratio narrowed from 74 to less than 67.      The supply/demand position has improved in the past year,  and despite a silver market surplus, the quantity of silver is  modest enough to be absorbed by investors, it added.      The report said the firmness in oil prices was likely to  continue in the short term.      A period of consolidation might be necessary before prices  attempted to move significantly higher,it said, but so long as  the dollar remains under pressure then the outlook for silver  was positive.      However silver was less likely to continue to outpace the  other metals by such a margin, Montagu said.  "
gold,"LAC MINERALS &lt;LAC> TO CLOSE LAKE SHORE MINE  LAC Minerals Ltd said it will suspend  underground mining and exploration at its Lake Shore Mine at  Kirkland Lake, Ontario, on April 30, pending results of a  surface exploration drilling program.      LAC said it does not expect the decision to affect  earnings, but 44 employees will be affected.      The company said it has completed mining the crown pillar  which has produced 71,000 ounces of gold since 1983. In 1986,  the mine produced 10,600 ounces. LAC said it will continue  surface drilling in 1987 to determine if further underground  exploration work is warranted.  "
livestock,"HOG AND CATTLE SLAUGHTER GUESSTIMATES  Chicago Mercantile Exchange floor  traders and commission house representatives are guesstimating  today's hog slaughter at about 287,000 to 295,000 head versus  292,000 week ago and 322,000 a year ago.      Cattle slaughter is guesstimated at about 124,000 to  128,000 head versus 129,000 week ago and 134,000 a year ago.  "
livestock,"U.S. FEEDER STEER PRICE  The U.S. Feeder Steer Price, or USFSP,  as posted by the CME is calculated by Cattle Fax and represents  the price used for cash settlement of the CME Feeder Cattle  contract.      The USFSP is a seven-calendar-day average of feeder steer  prices from 27 states, based on auction and direct country  sales for feeder steers that weigh between 600 and 800 lbs and  are estimated to grade between 60 and 80 pct choice when fed to  slaughter weight.      April 9         Previous quote      70.03             69.87  "
