category,text
livestock,"ARGENTINE MEAT EXPORTS LOWER IN 1986  Argentine meat exports during  Jan/Dec 1986 totalled 220,911 tonnes, against 223,204 tonnes  shipped in the same 1985 period, the National Meat board said.      Shipments in tonnes with comparative figures for the 1985  period, in brackets, included: beef 120,184 (137,686), horse  meat 25,651 (33,892) and beef offal 50,100 (47,745).      Argentina's meat exports totalled 20,481 tonnes in December  1986, against 15,801 tonnes in the same 1985 month.      Shipments in tonnes, with comparative figures for December  1985, in brackets, included: beef 14,384 (10,339), horse meat  1,609 (1,539) and beef offal 3,388 (3,098), the board said.      Main destinations for refrigerated beef (bone in  equivalent) were as follows, in tonnes, with comparative  figures for 1985 in brackets:      E.C. 46,300 (49,700), Israel 16,200 (17,600), Brazil 18,100  (unavailable), Peru 8,100 (2,300), Angola 4,800 (12,100), Chile  3,400 (8,200), Switzerland 3,000 (3,000), Canary Islands 2,400  (3,700), Singapore 1,900 (1,700), Aruba/Curazao 1,600 (1,700).      Main destinations for canned meat and cooked beef (bone in  equivalent) in tonnes, with figures for 1985 in brackets, were:  United States 88,300 (102,900), E.C. 30,700 (24,100).  "
gnp,"SPAIN REVISES ECONOMIC TARGETS FOR 1987  Spain has revised some of its main  economic targets for 1987 after studying the performance of the  economy in the first quarter, the economy ministry said in its  monthly bulletin.      Internal demand is now forecast to rise four pct against a  previous target of 3.5 pct.      Mariano Rubio, governor of the Bank of Spain, the central  bank, yesterday said internal demand was currently growing at  an annual rate of six pct and it had to be brought down to four  pct if the government were to meet its five pct inflation  target this year. Inflation was 8.3 pct in 1986.      The forecast for private consumption growth remains  unchanged at three pct, although public consumption is revised  upwards to 2.5 pct from 2.0 pct.      Growth in domestic demand will fuel imports, expected to  increase by 8.6 pct against an originally estimated 7.1 pct.      Export growth has been revised downwards to 3.7 pct from  5.2 pct due to the peseta's continuing strength against the  dollar and slack external demand.      Slow growth of exports and a tight rein on state spending  has lowered estimated GDP growth to three pct in 1987 from an  earlier forecast 3.5 pct. GDP grew by three pct last year.      The economy ministry is holding its inflation forecast to  five pct, in spite of minister Carlos Solchaga's doubts last  week on whether this target could be maintained if wage  settlements continue to rise above the government's recommended  five pct ceiling.      Unions and employers dispute the average wage increases  agreed so far this year. Trade unions calculate wage  settlements have produced average rises of 7.3 pct against 5.5  pct estimated by the employers' federation CEOE.  "
livestock,"JAPAN'S LIPC TO BUY BEEF ON APRIL 23  Japan's Livestock Industry Promotion Corp  (LIPC) said that on April 28 it will import 7,515 tonnes of  beef for the first half of the 1987 fiscal year started on  April 1 under the simultaneous buy and sell tender system,  against 6,813 a year ago.      The system calls on the agency to buy beef from trading  houses and simultaneously sell it to users in one tender. The  tender quota in April-September is 10 pct of the agency's beef  import share. Japan's beef import quota in 1987/88 was set at  93,000 tonnes against 85,000 for the same period in 1986/87.  "
gold,"SIGMA MINES DETAILS GOLD ORE RESERVES  &lt;Sigma Mines (Quebec) Ltd>, 65 pct  owned by Dome Mines Ltd, said its Sigma Mine had proven and  probable reserves at the end of 1986 of 4,902,940 tons, with an  average grade of 0.139 ounces of gold a ton.      Sigma said the reserves are equivalent to 10 years future  production at current milling rates.      The reserves comprise 1,640,779 tons proven reserves  grading an average of 0.163 ounces of gold a ton and 3,262,161  tons probable reserves grading an average of 0.127 ounces of  gold a ton.      Sigma said it changed its 1986 reserve reporting method  following Dome Mines' previously reported move to adopt general  industry practice of reporting proven and probable ore  reserves.      Prior to 1986, Sigma conservatively reported only proven  reserves that could be mined without future development costs.      Proven reserves as of December 31, 1985 were 978,000 tons  grading an average of 0.194 ounces of gold a ton, equivalent to  about two years future production.  "
gnp,"SOUTHERN EUROPE HAS STRONG DOMESTIC DEMAND GROWTH  Strong growth in domestic demand was a key  feature of the economies of southern European countries in  1986, though the growth is seen slowing this year and next, the  Organisation for Economic Cooperation and Development said.      In its semi-annual report, the OECD said Portugal's total  domestic demand growth would decline from 7.6 pct last year to  five pct in 1987 and 3.75 pct in 1988 as slower wage growth  restrained private consumption.      Turkey's economy grew much faster than expected in 1986 and  domestic demand surged 10.5 pct, but this growth was expected  to be halved to five pct next year.      In Spain, buoyant domestic demand, led by fixed investment,  had been the driving force behind rapid growth in Gross  Domestic Product. Both fixed investment and private consumption  were expected to ease during 1988 but would still remain  strong.      The OECD forecast that Spanish imports would rise sharply  next year, reflecting strong demand, entry to the European  Community and declining competitiveness.      In Greece, inflation was forecast to turn downwards  following an increase early this year linked with the  introduction of Value Added Tax and a surge in food prices due  to cold weather.  "
nat-gas,"ALLEGHENY &lt;ALGH.O> FORMING SUBSIDIARY  Allegheny and Western Energy Corp said  it was forming a subsidiary to market gas to smaller users in  West Virginia.      The company also said it completed negotiations to sell  between 10 and 12 mln cubic feet of gas per day to a large,  unspecified East Coast utility.      Interstate markets will become part of the subsidiary's  operations, the company said.  "
gnp,"TURKEY ESTIMATES 1986 GROWTH AT EIGHT PCT  Turkey's Gross National Product grew an  estimated 8.0 pct in 1986 at fixed 1968 prices, compared with  5.1 pct in 1985, the State Statistics Institute said.      Reporting full-year data, it also said Gross Domestic  Product rose 8.3 pct compared with 5.1 pct in 1985. An earlier  estimate from nine-month data put full-year GNP and GDP growth  both at 7.9 pct.      The government's GNP growth target for 1987 is five pct,  the same level it had set for 1986.      The institute estimated per capita GNP for 1986 at 1,116.6  dlrs, up from 1,045.3 dlrs in 1985.      Officials blame the high 1986 GNP growth on a surge in  domestic demand stemming partly from poorly controlled  municipal expenditures in the early part of the year.      Industry grew at 11.1 pct in real terms in 1986 compared  with 6.6 pct in 1985 while agriculture expanded 7.4 pct  compared with 2.8 pct.  "
gold,"HOMESTAKE MULLS BUYING ORE RESERVES  Homestake Mining Co is considering  acquiring more gold ore reserves in addition to the company's  exploration efforts, chief executive Harry Conger told Reuters  in an interview.      Conger said, ""the move to consider acquisitions represents  a change in the company's acquistions policy.""      Conger said all of Homestake's current cash position of 120  mln dlrs would be available to acquire reserves. In addition,  Homestake has two lines of credit totaling 150 mln dlrs which  have not been drawn on and could be used to finance an  acquisition, he said.      Conger said he anticipates 1987 exploration budget will be  about the same as 1986 spending of 27.3 mln dlrs.      Conger said exploration for precious metals may be slightly  higher than last year's spending of 17.7 mln dlrs while oil and  gas exploration spending will be slightly less than last year's  9.6 pct.      Conger said he sees Homestake's 1987 gold production about  the same as 1986 gold production of 669,594 ounces.      However, 1987 first quarter production from its McLaughlin  reserve will be about 10 pct lower than last year's 45,400  ounces due to start-up production problems.      He said he believes gold prices will hold above the 400  U.S. dlr an ounce level for the rest of 1987.  "
gold,"SPHINX MINING &lt;SPNXF.O> FINDS GOLD  Sphinx Mining Inc said leased  mining claims in Alaska could produce revenues between 322 mln  dlrs and 966 mln dlrs from gold reserves.      The range of the value of the reserves is attributed to the  wide range of grade estimates of the ore, the company said.      A 1984 feasibility study put the grade at 0.008 ounces per  cubic yard, while subsequent exploration work proved that areas  of higher-grade gravel of up to 0.027 ounces/yard do exist,  Sphinx said.      The claims are located 80 miles northwest of Fairbanks.  "
gnp,"ECONOMIC GROWTH SEEN SLUGGISH IN BENELUX COUNTRIES  Economic growth will remain sluggish in  the Netherlands and Belgium next year and unemployment may  rise, the Organisation for Economic Cooperation and Development  forecast.      Belgium's GDP growth may slow down to 1.5 pct this year and  next year, bringing a rise in the number of jobless, the OECD  said in its semi-annual survey. Belgian inflation could  stabilise at 1.5 to 2.0 pct, while the current account surplus  will probably remain large at about three pct of GDP.      While the Belgian government has made progress in trimming  its borrowing requirement, ""it will probably be insufficient to  check the self-sustaining nature of the deficit,"" the OECD said.      In the Netherlands real GDP growth will also slip to 1.5  pct this year and one pct in 1988, with Dutch exports becoming  less competitive and imports rising. ""Employment is forecast to  decelerate as well, reflecting more sluggish growth in the  private sector and budgetary cuts,"" the report said.      Dutch consumer prices are set to fall by 0.5 pct in 1987  and stay stable in 1988, partly as a result of declining  domestic gas prices.      Luxembourg's economy, by contrast, will see slightly faster  growth in GDP this year as a result of an upward movement in  wages. But real growth in consumption will ease next year.  "
livestock,"FRANCE WILL FIGHT EC FARM PROPOSALS - MINISTER  French Agricultural Minister  Francois Guillaume warned that France would flatly reject  proposed reforms of the European Community, EC, cereals, sugar  and oilseeds sectors, which he said would disrupt these  markets.      The EC Commission's proposals to shorten the intervention  period and lower monthly premiums for cereals and increase the  financial burden on the sugar producers will also result in  lower real prices for producers, he told farmers here.      ""I give you my word that France, while it will not reject  technical adjustments or serious discussion, will simply reply  in the negative to these bad reforms,"" Guillaume told the annual  conference of the country's major farm union, FNSEA   (Federation Nationale des Syndicats Dexploitants Agricoles).      Community agricultural ministers are due to meet again  Monday to try and agree a package of reforms to curb spiralling  EC output and fix farm prices for 1987/88.      Relations between the government and farmers have become  strained in France in recent months.      There have been sporadic but frequent demonstrations by  farmers protesting over sharp falls in meat and pork prices and  further cutbacks in Community milk output.      But Guillaume's warning that he would reject reorganisation  of the EC cereal and sugar markets -- France being a major  producer of both crops -- won him warm applause from the  FNSEA's farmers.      His pledge to fight the EC proposals and push for the  complete dismantling of the system of cross border taxes  designed to smooth out currency differences known as Monetary  Compensatory Amounts, MCA's, however, are unlikely to avoid  further protests by producers.      Farm leader Raymond Lacombe said the union planned to go  ahead with a series of major protests both in France and abroad  against the EC Commission's proposals to overhaul the farm  sector.      ""The Minister's proposals back up our determination to  organise union action in the coming weeks,"" he told reporters,  adding that this could also act in Guillaume's favour on a  ministerial level.      Guillaume was head of the FNSEA for many years before being  appointed farm minister last spring.      Lacombe refused to say whether the farmers felt that  Guillaume was doing a good job as farm minister.      There have been certain advances on cutting production  costs, reducing fiscal costs and awarding drought aid, but  there are still areas where more could be done such as on  farmers' indebtedness, he said.      Guillaume told the conference the government will make  available 2.4 billion francs (396 mln dlrs) to help producers  reduce milk output and to encourage older farmers to retire.      The government has already announced financial aid for the  milk sector and it was not clear how much of the package  announced today was new aid, Lacombe said.  "
gnp,"S.AFRICA EXPECTED TO UNVEIL EXPANSIONARY BUDGET  South Africa is expected to unveil  tomorrow an expansionary budget for the second consecutive year  in a bid to boost the nation's flagging economic growth rate,  economic analysts said.      Faced with competing demands for increased military and  police spending and the pressing need for more funds for black  housing and education, Finance Minister Barend Du Plessis is  expected to raise significantly the government's overall  expenditure targets when he presents the budget to parliament,  the analysts said.      Analysts expect Du Plessis to provide for a rise in state  spending at least equal to the 16 pct inflation rate for the  financial year that started on April 1, while ignoring pleas  from the private sector to stimulate growth by cutting taxes.      ""Fiscal policy has become gradually more expansionary, but  simply raising government spending and increasing the budget  deficit is an inflationary form of stimulation,"" said Rob Lee,  chief economist at South African Mutual Life Assurance Co.      South Africa this year is targeting inflation-adjusted  growth in GDP of three pct against an increase last year of  less than one pct.      Growth in GDP over the past decade has averaged about 1.5  pct, while the unemployment rate among blacks has spiralled to  over 30 pct.      Economists estimate that the government's spending target  will rise to about 47 billion rand, with revenue budgeted at  around 40 billion rand. This would leave a budget deficit  before borrowing of about seven billion rand, or four pct of  GDP.      The government, having consistently overshot its own  spending targets for more than a decade, also faces a  credibility crisis over expenditure figures outlined in the  budget, analysts said.      ""The budget is invariably too optimistic on expenditure,""  said Standard Bank Ltd in a budget preview.      Many analysts in the private sector are now paying less  attention to the figures presented in the budget and are using  their own estimates of expenditure to draw conclusions for the  money and capital markets.      South African Mutual's Lee believes government spending  will again exceed the budget target and increase to around 49  billion rand this year, leaving a deficit of between 5 and 5.5  pct of GDP, compared with a three pct limit suggested by the  IMF.      ""The IMF limit is obviously going to be abandoned,"" predicted  one analyst, noting that South Africa has moved steadily away  from austerity measures recommended by the IMF over the past  two years.      The policy shift followed a dramatic deterioration in the  political situation and the onset of an economic crisis  triggered by the refusal of major foreign banks to roll over  loans to the country in September 1985.      Against a background of Western economic sanctions, falling  per capita incomes, rising joblessness and high inflation,  government officials say economic growth is the prime  objective.      But private-sector economists caution that the government's  ability to promote growth by boosting state spending is  constrained by the need to maintain a large surplus on the  current account of the country's balance of payments.      Most of that surplus, this year estimated at around 2.5  billion dlrs, will be swallowed up by repayments on the  nation's estimated 23 billion dlr foreign debt in terms of an  arrangement reached earlier this year with major international  creditor banks.      Within these constraints, economists believe Du Plessis has  little room to manoeuvre.      Analysts argue recent rises in civil service salaries and  budgeted spending increases for the state-owned Post Office and  South African Transport Services suggest that major tax  concessions to individuals or corporations are unlikely.      Du Plessis earlier this year announced small concessions  for taxpayers in a mini-budget before the May 6 whites-only  election. The poll delayed presentation of the national budget.      ""This will not be a very exciting budget,"" commented Harry  Schwarz, spokesman on finance for the liberal Progressive  Federal Party. ""I do not expect any major tax cuts as all the  sweets were given out before the election.""  "
nat-gas,BRITISH PETROLEUM RAISES NORTH SEA BUTANE PRICES BY 15.50DLRS A TONNE TODAY  BRITISH PETROLEUM RAISES NORTH SEA BUTANE PRICES BY 15.50  DLRS A TONNE TODAY  
gold,"PRECIOUS METALS CLIMATE IMPROVING, SAYS MONTAGU  The climate for precious metals is  improving with prices benefiting from renewed inflation fears  and the switching of funds from dollar and stock markets,  brokers Samuel Montagu and Co Ltd said.      Silver prices in March gained some 15 pct in dlr terms due  to a weak dollar and silver is felt to be fairly cheap relative  to gold, Montagu said in its monthly silver newsletter. In  March the gold/silver ratio narrowed from 74 to less than 67.      The supply/demand position has improved in the past year,  and despite a silver market surplus, the quantity of silver is  modest enough to be absorbed by investors, it added.      The report said the firmness in oil prices was likely to  continue in the short term.      A period of consolidation might be necessary before prices  attempted to move significantly higher,it said, but so long as  the dollar remains under pressure then the outlook for silver  was positive.      However silver was less likely to continue to outpace the  other metals by such a margin, Montagu said.  "
livestock,"PORK CHECKOFF REFUNDS LESS THAN EXPECTED  The National Pork Board announced at the  American Pork Congress convention in Indianapolis that refunds  under the legislative checkoff program are running less than  expected.      The Board oversees collection and distribution of funds  from the checkoff program that was mandated by the 1985 farm  bill. Virgil Rosendale, a pork producer from Illinois and  chairman of the National Pork Board, said over 2.2 mln dlrs was  collected in January and refunds are running almost nine pct,  considerably less than expected.      ""We believe that this indicates good producer support for  the new checkoff. We're getting good compliance from markets,  from packers and from dealers,"" Rosendale said.  "
gold,"NORTH KOREA TO RESURRECT GOLD MINE TO REPAY DEBT  Pyongyang and a group of Tokyo-based  North Korean businessmen plan to resurrect a North Korean  goldmine and boost annual output to almost one tonne within two  years from 600 pounds at present, said Li Sangsu, a spokesman  for &lt;Unzan Mine Development Co>, the venture partner.      Work will begin on April 3 and the company aims to increase  output to 10 tonnes within a decade to pay off Pyongyang's 70  billion yen debt to 30 Japanese companies, Li added.      ""We expect this mine to be worth about 2,000 billion yen in  gold deposits,"" he said.      The mine, started in 1896 by a U.S. Company, is one of six  or seven virtually untapped mines in the Unzan area, 94 miles  north of Pyongyang, Li said.      Li said modern equipment and advanced technology would  increase yields. ""Up to now, the mining was done with antiquated  methods and basic equipment.""      The gold mine scheme is the latest in a series of moves by  North Korea to clear its debts to Japanese creditors.      Earlier this year, Pyongyang tried and failed to pay off  part of its debt with several tonnes of fish.  "
nat-gas,"TEXACO &lt;TX> RESERVES DOWN DESPITE LOWER OUTPUT  Texaco Inc's oil and gas reserves  declined in 1986 despite reduced production and upward  revisions in the company's previous reserve estimates, its  annual report said.      The statement of the report's auditor was qualified -- as  was the previous one -- because of the unkonwn final impact of  the judgement won by Pennzoil Co &lt;PZL> against Texaco on  charges Texaco interfered with Pannzoil's contract to acquire  Getty Oil Co.      The auditor's point out, as Texaco has in the past, the  company's loss of any of several pending court decisions in  this case could cause it ""to face prospects such as having to  seek protection of its assets and business pursuant to the  bankruptcy and reorganization provisions of Chapter 11"" of the  federal bankruptcy code.      Commenting on a Texas Court of Appeals ruling which reduced  Pennzoil's judgement by two billion dlrs, to 9.1 billion dlrs,  Texaco said it will file a motion for a rehearing by the  appeals court no later than March 30.      Texaco said the proven crude oil reserves of the company  and its consolidated subsidiaries totaled 2.54 billion barrels  at the end of 1986, down from 2.69 billion a year earlier.      However, inclusion of Texaco's equity in the Eastern  Hemisphere reserves of a nonsubsidiary company limited the  decline to 2.91 billion barrels from 3.00 billion at the end of  1985.      Worldwide production by the consolidated subsidiaries  declined to 341 mln barrels last year from 362 mln in 1985 and  upward revisions in previous reserve estimates rose to 143 mln  barrels from 117 mln, respectively.      Texaco said the largest drop in reserves came in the United  States -- where the total dropped to 1.46 billion barrels from  1.55 billion.      The company said U.S. liquids production averaged 660,000  barrels per day last year, down from 714,000 in 1985, with  about 44 pct of the decline -- some 24,000 barrels per day --  representing high-cost production shut-in or curtailed in  response to the decline in crude oil prices during 1986.      Texaco said its natural gas reserves totaled 8.16 trillion  cubic feet at year end, down from 8.87 trillion cubic feet at  the end of 1985.  "
gold,"U.S. GOLD, SILVER, PLATINUM SOAR ON VOLCKER REJECTION OF 3RD TERM  U.S. GOLD, SILVER, PLATINUM SOAR ON VOLCKER REJECTION OF 3RD TERM  "
livestock,"OCCIDENTAL UNIT &lt;OXY> LIFTS LOCKOUT  Iowa Beef Processors Inc is lifting a  lockout at its Dakota City, Nebraska processing plant and plans  to resume operations March 16, United Food and Commercial  Workers Union spokesman Allen Zack said by phone from his  Washington, D.C. headquarters.      Iowa Beef, a susbsidiary of Occidental Petroleum Corp,  mailed a letter to members of UFCWU Local 222 informing them a  lockout imposed by the company on December 14 would be lifted  and meatpackers could return to work under Iowa Beef's  ""revised, last and best final offer,"" according to Zack.      The letter was signed by four managers at the Dakota City  plant.      Iowa Beef closed the proessing plant indefinitely in  mid-December because, it said, it had no alternative to threats  by meatpackers to disrupt operations.      About 2,800 members of Local 222 are affected by the  shutdown. A 3-1/2 year labor contract at the plant expired  December 13.  "
gold,"ST. JOE GOLD TO DEVELOP ONTARIO MINE  St. Joe Gold Corp said it plans to  proceed with development of its Golden Patricia gold property  in northwestern Ontario.      It said about five mln dlrs will be spent to continue  underground development and obtain operating permits and  another 10.2 mln dlrs is expected to be required to complete  underground development, construct a mill and provide the  infrastructure needed to put the mine into commercial  production.      St. Joe Gold said if the necessary operating permits were  granted in time, it would start gold production in the second  half of the year ending October 31, 1988 at an annual rate of  about 40,000 troy ounces.      The company said the property is estimated to contain over  500,000 troy ounces of gold, and the initial mining project  covers only seven of 192 claims, with drill-indicated reserves  of 293,000 short tons grading 0.88 troy ounce of gold per ton.      It said initial mine output is expected to be about 150  tons of ore daily.      St. Joe Gold said the Golden Patricia vein has not been  tested at depth or along strike to the east and west and  exploration is continuing on the Golden Patricia property and  the adjacent wholly-owned Muskeg Lake property.      The company also said its Richmond Hill gold and silver  deposit in the Carbonate district of western South Dakota has  been shown by drilling to contain about 3,900,000 tons grading  0.055 troy ounce of gold and 0.23 troy ounce of silver per ton.   It said preliminary results are encouraging and a feasibility  study is nearing completion.  "
